{
  "schema_version": 1,
  "id": "option-and-result.010",
  "version": 1,
  "title": "Transforming Error Types",
  "track": "option-and-result",
  "concepts": [
    "error-propagation"
  ],
  "difficulty": 2,
  "goal": "Convert a ParseIntError into a String error when returning Result.",
  "prerequisites": [],
  "source": {
    "origin": "comprehensive-rust",
    "license": "CC-BY-4.0",
    "attribution": "adapted from Day 4 Morning: Option and Result"
  },
  "template": "fn parse_port(s: &str) -> Result<u16, String> {\n    let port = s.parse::<u16>()⟦map_slot⟧⟦prop_slot⟧;\n    Ok(port)\n}\n\nfn main() {\n    println!(\"{:?}\", parse_port(\"8080\"));\n}\n",
  "interaction": {
    "type": "minimal-edit",
    "slots": [
      {
        "id": "map_slot",
        "original": "",
        "label": "error mapping",
        "choices": [
          {
            "id": "ma1",
            "text": ".map_err(|e| e.to_string())"
          },
          {
            "id": "ma2",
            "text": ""
          },
          {
            "id": "ma3",
            "text": ".map(|p| p.to_string())"
          }
        ]
      },
      {
        "id": "prop_slot",
        "original": ".unwrap()",
        "label": "propagation",
        "choices": [
          {
            "id": "pr1",
            "text": "?"
          },
          {
            "id": "pr2",
            "text": ".unwrap()"
          },
          {
            "id": "pr3",
            "text": ""
          }
        ]
      }
    ]
  },
  "evaluation": {
    "tests": [
      "#[test]\nfn parses_valid_port() {\n    assert_eq!(parse_port(\"8080\"), Ok(8080));\n}",
      "#[test]\nfn maps_invalid_port_error() {\n    assert!(parse_port(\"abc\").is_err());\n}"
    ],
    "metrics": [
      "token_edits"
    ]
  },
  "scoring": {
    "primary": "token_edits",
    "secondary": [],
    "fluent": {
      "token_edits": 2
    },
    "optimal": {
      "token_edits": 2
    }
  },
  "hints": [
    "s.parse produces ParseIntError, but parse_port returns String as its error type.",
    "Use map_err to convert the error before propagating with ?"
  ],
  "explanation": "The `?` operator fails with `E0277` when error types do not match and no `From` conversion exists. Calling `.map_err(|e| e.to_string())` converts `ParseIntError` into `String` so `?` can return `Err(String)`. Calling `.unwrap()` panics on invalid input instead of returning an error."
}
